"Chuu J.Y.-J.; Taylor J.L.; Tinklenberg J.; Noda A.; Yesavage J.; Murphy Jr. G.M.","Chuu, Jenny Y.-J. (13005698800); Taylor, Joy L. (7405408425); Tinklenberg, Jared (7005047793); Noda, Art (7101817716); Yesavage, Jerome (7102697192); Murphy Jr., Greer M. (7402791409)","13005698800; 7405408425; 7005047793; 7101817716; 7102697192; 7402791409","The brain-derived neurotrophic factor Val66Met polymorphism and rate of decline in Alzheimer's disease","2006","Journal of Alzheimer's Disease","9","1","","43","49","6","13","10.3233/JAD-2006-9104","https://www.scopus.com/inward/record.uri?eid=2-s2.0-33645987910&doi=10.3233%2fJAD-2006-9104&partnerID=40&md5=cd9e0b1c3c35693792e67fff0b865910","Department of Psychiatry and Behavioral Sciences, MSLS P-104, Stanford University School of Medicine, Stanford, CA 94305-5485, United States","Chuu J.Y.-J.; Taylor J.L.; Tinklenberg J.; Noda A.; Yesavage J.; Murphy Jr. G.M., Department of Psychiatry and Behavioral Sciences, MSLS P-104, Stanford University School of Medicine, Stanford, CA 94305-5485, United States","G.M. Murphy Jr.; Department of Psychiatry and Behavioral Sciences, MSLS P-104, Stanford University School of Medicine, Stanford, CA 94305-5485, United States; email: gmurphy@stanford.edu","","IOS Press","13872877","","JADIF","16627933","English","J. Alzheimer's Dis.","Article","Final","","Scopus","2-s2.0-33645987910"
"Das J.R.; Tizabi Y.","Das, Jharna R. (57198259329); Tizabi, Yousef (7003324781)","57198259329; 7003324781","Additive protective effects of donepezil and nicotine against salsolinol-induced cytotoxicity in SH-SY5Y cells","2009","Neurotoxicity Research","16","3","","194","204","10","35","10.1007/s12640-009-9040-2","https://www.scopus.com/inward/record.uri?eid=2-s2.0-70349898590&doi=10.1007%2fs12640-009-9040-2&partnerID=40&md5=d36867e59ef82c804548a1b6515f5d39","Department of Pharmacology, College of Medicine, Howard University, Washington, DC 20059, 520 W Street NW, United States","Das J.R., Department of Pharmacology, College of Medicine, Howard University, Washington, DC 20059, 520 W Street NW, United States; Tizabi Y., Department of Pharmacology, College of Medicine, Howard University, Washington, DC 20059, 520 W Street NW, United States","Y. Tizabi; Department of Pharmacology, College of Medicine, Howard University, Washington, DC 20059, 520 W Street NW, United States; email: ytizabi@howard.edu","","","10298428","","NURRF","19526284","English","Neurotoxic. Res.","Article","Final","","Scopus","2-s2.0-70349898590"
"Bizrah M.; Guo L.; Cordeiro M.F.","Bizrah, Mukhtar (38661095500); Guo, Li (42561262400); Cordeiro, Maria Francesca (57210287162)","38661095500; 42561262400; 57210287162","Glaucoma and Alzheimer's disease in the elderly","2011","Aging Health","7","5","","719","733","14","12","10.2217/ahe.11.51","https://www.scopus.com/inward/record.uri?eid=2-s2.0-80054095604&doi=10.2217%2fahe.11.51&partnerID=40&md5=5cf75b310f39e9cf645fbf01c95382df","Glaucoma and Retinal Neurodegeneration Research Group, Visual Neuroscience, UCL Institute of Ophthalmology, London, United Kingdom; Guy's and St. Thomas' NHS Foundation Trust, London, United Kingdom","Bizrah M., Glaucoma and Retinal Neurodegeneration Research Group, Visual Neuroscience, UCL Institute of Ophthalmology, London, United Kingdom, Guy's and St. Thomas' NHS Foundation Trust, London, United Kingdom; Guo L., Glaucoma and Retinal Neurodegeneration Research Group, Visual Neuroscience, UCL Institute of Ophthalmology, London, United Kingdom; Cordeiro M.F., Glaucoma and Retinal Neurodegeneration Research Group, Visual Neuroscience, UCL Institute of Ophthalmology, London, United Kingdom","M.F. Cordeiro; Western Eye Hospital, Imperial College Healthcare Trust, London, United Kingdom; email: m.cordeiro@ucl.ac.uk","","","17455103","","","","English","Aging Health","Review","Final","","Scopus","2-s2.0-80054095604"
"Paroni G.; Seripa D.; Fontana A.; D’Onofrio G.; Gravina C.; Urbano M.; Cascavilla L.; Pellegrini F.; Greco A.; Pilotto A.","Paroni, Giulia (12798793000); Seripa, Davide (6602180406); Fontana, Andrea (35573405800); D’Onofrio, Grazia (57652481400); Gravina, Carolina (6602550116); Urbano, Maria (9939569100); Cascavilla, Leandro (15519309100); Pellegrini, Fabio (7006173864); Greco, Antonio (55046558500); Pilotto, Alberto (7006878417)","12798793000; 6602180406; 35573405800; 57652481400; 6602550116; 9939569100; 15519309100; 7006173864; 55046558500; 7006878417","FOXO1 locus and acetylcholinesterase inhibitors in elderly patients with Alzheimer’s disease","2014","Clinical Interventions in Aging","9","","","1783","1791","8","14","10.2147/CIA.S64758","https://www.scopus.com/inward/record.uri?eid=2-s2.0-84908224064&doi=10.2147%2fCIA.S64758&partnerID=40&md5=5b9b5b1847e948106a9cd7b6ad6b8055","Gerontology and Geriatrics Research Laboratory, IRCCS Casa Sollievo della Sofferenza, San Giovanni Rotondo, FG, Italy; Unit of Biostatistics, IRCCS Casa Sollievo della Sofferenza, San Giovanni Rotondo, FG, Italy; Unit of Biostatistics, Fondazione Mario Negri Sud, Santa Maria Imbaro, CH, Italy; Geriatrics Unit, Azienda ULSS16 Padova, San Antonio Hospital, Padova, Italy","Paroni G., Gerontology and Geriatrics Research Laboratory, IRCCS Casa Sollievo della Sofferenza, San Giovanni Rotondo, FG, Italy; Seripa D., Gerontology and Geriatrics Research Laboratory, IRCCS Casa Sollievo della Sofferenza, San Giovanni Rotondo, FG, Italy; Fontana A., Unit of Biostatistics, IRCCS Casa Sollievo della Sofferenza, San Giovanni Rotondo, FG, Italy; D’Onofrio G., Gerontology and Geriatrics Research Laboratory, IRCCS Casa Sollievo della Sofferenza, San Giovanni Rotondo, FG, Italy; Gravina C., Gerontology and Geriatrics Research Laboratory, IRCCS Casa Sollievo della Sofferenza, San Giovanni Rotondo, FG, Italy; Urbano M., Gerontology and Geriatrics Research Laboratory, IRCCS Casa Sollievo della Sofferenza, San Giovanni Rotondo, FG, Italy; Cascavilla L., Gerontology and Geriatrics Research Laboratory, IRCCS Casa Sollievo della Sofferenza, San Giovanni Rotondo, FG, Italy; Pellegrini F., Unit of Biostatistics, IRCCS Casa Sollievo della Sofferenza, San Giovanni Rotondo, FG, Italy, Unit of Biostatistics, Fondazione Mario Negri Sud, Santa Maria Imbaro, CH, Italy; Greco A., Gerontology and Geriatrics Research Laboratory, IRCCS Casa Sollievo della Sofferenza, San Giovanni Rotondo, FG, Italy; Pilotto A., Gerontology and Geriatrics Research Laboratory, IRCCS Casa Sollievo della Sofferenza, San Giovanni Rotondo, FG, Italy, Geriatrics Unit, Azienda ULSS16 Padova, San Antonio Hospital, Padova, Italy","","","Dove Medical Press Ltd.","11769092","","","25364236","English","Clin. Interventions Aging","Article","Final","All Open Access; Gold Open Access","Scopus","2-s2.0-84908224064"
"Cubells J.F.; Deoreo E.H.; Harvey P.D.; Garlow S.J.; Garber K.; Adam M.P.; Martin C.L.","Cubells, Joseph F. (7004776939); Deoreo, Elizabeth H. (37064197400); Harvey, Philip D. (7401432064); Garlow, Steven J. (6602831206); Garber, Kathryn (13408303300); Adam, Margaret P. (10440431800); Martin, Christa Lese (56748304900)","7004776939; 37064197400; 7401432064; 6602831206; 13408303300; 10440431800; 56748304900","Pharmaco-genetically guided treatment of recurrent rage outbursts in an adult male with 15q13.3 deletion syndrome","2011","American Journal of Medical Genetics, Part A","155","4","","805","810","5","37","10.1002/ajmg.a.33917","https://www.scopus.com/inward/record.uri?eid=2-s2.0-79953325912&doi=10.1002%2fajmg.a.33917&partnerID=40&md5=1ff32e4ffa92584c9c44300738eb7577","Department of Human Genetics, Emory University School of Medicine, Atlanta, GA, United States; Department of Psychiatry and Behavioral Sciences, Emory University School of Medicine, Atlanta, GA, United States; Emory Autism Center, Atlanta, GA, United States; Department of Pediatrics, University of Washington School of Medicine, Seattle, WA, United States","Cubells J.F., Department of Human Genetics, Emory University School of Medicine, Atlanta, GA, United States, Department of Psychiatry and Behavioral Sciences, Emory University School of Medicine, Atlanta, GA, United States, Emory Autism Center, Atlanta, GA, United States; Deoreo E.H., Department of Psychiatry and Behavioral Sciences, Emory University School of Medicine, Atlanta, GA, United States; Harvey P.D., Department of Psychiatry and Behavioral Sciences, Emory University School of Medicine, Atlanta, GA, United States; Garlow S.J., Department of Psychiatry and Behavioral Sciences, Emory University School of Medicine, Atlanta, GA, United States; Garber K., Department of Human Genetics, Emory University School of Medicine, Atlanta, GA, United States; Adam M.P., Department of Human Genetics, Emory University School of Medicine, Atlanta, GA, United States, Department of Pediatrics, University of Washington School of Medicine, Seattle, WA, United States; Martin C.L., Department of Human Genetics, Emory University School of Medicine, Atlanta, GA, United States","J.F. Cubells; Department of Human Genetics, Atlanta, GA 30322, 615 Michael St., Suite 301, United States; email: jcubell@emory.edu","","","15524833","","AJMGD","21594999","English","Am. J. Med. Genet. Part A","Article","Final","","Scopus","2-s2.0-79953325912"
"Peng Y.; Jiang L.; Lee D.Y.W.; Schachter S.C.; Ma Z.; Lemere C.A.","Peng, Ying (56449790500); Jiang, Liying (35082047100); Lee, David Y.W. (55808069913); Schachter, Steven C. (7005725553); Ma, Zhongze (8709903000); Lemere, Cynthia A. (7003454490)","56449790500; 35082047100; 55808069913; 7005725553; 8709903000; 7003454490","Effects of huperzine A on amyloid precursor protein processing and β-amyloid generation in human embryonic kidney 293 APP swedish mutant cells","2006","Journal of Neuroscience Research","84","4","","903","911","8","48","10.1002/jnr.20987","https://www.scopus.com/inward/record.uri?eid=2-s2.0-33748539424&doi=10.1002%2fjnr.20987&partnerID=40&md5=377eded10b2fe2ed3bc7c445abdf8e5b","Center for Neurologic Diseases, Harvard Medical School, Brigham and Women's Hospital, Boston, MA, United States; Bio-Organic and Natural Products Laboratory, McLean Hospital, Harvard Medical School, Belmont, MA, United States; Department of Neurology, Division of Research and Education in Complementary and Integrative Medical Therapies, Harvard Medical School, Boston, MA, United States; Department of Neurology, Harvard Medical School, Brigham and Women's Hospital, Boston, MA 02115, 77 Avenue Louis Pasteur, United States","Peng Y., Center for Neurologic Diseases, Harvard Medical School, Brigham and Women's Hospital, Boston, MA, United States; Jiang L., Center for Neurologic Diseases, Harvard Medical School, Brigham and Women's Hospital, Boston, MA, United States; Lee D.Y.W., Bio-Organic and Natural Products Laboratory, McLean Hospital, Harvard Medical School, Belmont, MA, United States; Schachter S.C., Department of Neurology, Division of Research and Education in Complementary and Integrative Medical Therapies, Harvard Medical School, Boston, MA, United States; Ma Z., Bio-Organic and Natural Products Laboratory, McLean Hospital, Harvard Medical School, Belmont, MA, United States; Lemere C.A., Center for Neurologic Diseases, Harvard Medical School, Brigham and Women's Hospital, Boston, MA, United States, Department of Neurology, Harvard Medical School, Brigham and Women's Hospital, Boston, MA 02115, 77 Avenue Louis Pasteur, United States","C.A. Lemere; Department of Neurology, Harvard Medical School, Brigham and Women's Hospital, Boston, MA 02115, 77 Avenue Louis Pasteur, United States; email: clemere@rics.bwh.harvard.edu","","","10974547","","JNRED","16862548","English","J. Neurosci. Res.","Article","Final","","Scopus","2-s2.0-33748539424"
"Toiber D.; Berson A.; Greenberg D.; Melamed-Book N.; Diamant S.; Soreq H.","Toiber, Debra (8892329900); Berson, Amit (57214367150); Greenberg, David (35498753500); Melamed-Book, Naomi (6602537173); Diamant, Sophia (7003587739); Soreq, Hermona (35464534500)","8892329900; 57214367150; 35498753500; 6602537173; 7003587739; 35464534500","N-acetylcholinesterase-induced apoptosis in alzheimer's disease","2008","PLoS ONE","3","9","e3108","","","","90","10.1371/journal.pone.0003108","https://www.scopus.com/inward/record.uri?eid=2-s2.0-52149104322&doi=10.1371%2fjournal.pone.0003108&partnerID=40&md5=7dff3f9377014b29af23c551e0316bdb","Department of Biological Chemistry, The Hebrew University of Jerusalem, Jerusalem, Israel; Interdisciplinary Center for Neuronal Computation (ICNC), The Hebrew University of Jerusalem, Jerusalem, Israel","Toiber D., Department of Biological Chemistry, The Hebrew University of Jerusalem, Jerusalem, Israel; Berson A., Department of Biological Chemistry, The Hebrew University of Jerusalem, Jerusalem, Israel; Greenberg D., Department of Biological Chemistry, The Hebrew University of Jerusalem, Jerusalem, Israel; Melamed-Book N., Department of Biological Chemistry, The Hebrew University of Jerusalem, Jerusalem, Israel; Diamant S., Department of Biological Chemistry, The Hebrew University of Jerusalem, Jerusalem, Israel; Soreq H., Department of Biological Chemistry, The Hebrew University of Jerusalem, Jerusalem, Israel, Interdisciplinary Center for Neuronal Computation (ICNC), The Hebrew University of Jerusalem, Jerusalem, Israel","","","","19326203","","","18769671","English","PLoS ONE","Article","Final","All Open Access; Gold Open Access; Green Open Access","Scopus","2-s2.0-52149104322"
"Pákáski M.; Fehér A.; Juhász A.; Drótos G.; Fazekas O.C.; Kovács J.; Janka Z.; Kálmán J.","Pákáski, Magdolna (6603871359); Fehér, Ágnes (57194531160); Juhász, Anna (7101843661); Drótos, Gergely (54795160400); Fazekas, Örsike Csilla (54881021200); Kovács, János (57196849561); Janka, Zoltán (7007162221); Kálmán, János (7103034412)","6603871359; 57194531160; 7101843661; 54795160400; 54881021200; 57196849561; 7007162221; 7103034412","Serum adipokine levels modified by donepezil treatment in Alzheimer's disease","2014","Journal of Alzheimer's Disease","38","2","","371","377","6","27","10.3233/JAD-131139","https://www.scopus.com/inward/record.uri?eid=2-s2.0-84889583003&doi=10.3233%2fJAD-131139&partnerID=40&md5=288b853bc645a8f601ee5e8396c2600a","Department of Psychiatry, University of Szeged, Szeged H-6701, Kálvária sgt. 57, Hungary","Pákáski M., Department of Psychiatry, University of Szeged, Szeged H-6701, Kálvária sgt. 57, Hungary; Fehér A., Department of Psychiatry, University of Szeged, Szeged H-6701, Kálvária sgt. 57, Hungary; Juhász A., Department of Psychiatry, University of Szeged, Szeged H-6701, Kálvária sgt. 57, Hungary; Drótos G., Department of Psychiatry, University of Szeged, Szeged H-6701, Kálvária sgt. 57, Hungary; Fazekas O.C., Department of Psychiatry, University of Szeged, Szeged H-6701, Kálvária sgt. 57, Hungary; Kovács J., Department of Psychiatry, University of Szeged, Szeged H-6701, Kálvária sgt. 57, Hungary; Janka Z., Department of Psychiatry, University of Szeged, Szeged H-6701, Kálvária sgt. 57, Hungary; Kálmán J., Department of Psychiatry, University of Szeged, Szeged H-6701, Kálvária sgt. 57, Hungary","M. Pákáski; Department of Psychiatry, University of Szeged, Szeged H-6701, Kálvária sgt. 57, Hungary; email: magdolna.pakaski@gmail.com","","IOS Press","13872877","","JADIF","23979024","English","J. Alzheimer's Dis.","Article","Final","","Scopus","2-s2.0-84889583003"
"Marques I.B.; Tábuas-Pereira M.; Milheiro M.; Santana I.","Marques, Inês B. (55910750000); Tábuas-Pereira, Miguel (56493155900); Milheiro, Miguel (56493158800); Santana, Isabel (6603922366)","55910750000; 56493155900; 56493158800; 6603922366","Biparietal variant of alzheimer's disease: A rare presentation of a common disease","2015","BMJ Case Reports","2015","","207011","","","","5","10.1136/bcr-2014-207011","https://www.scopus.com/inward/record.uri?eid=2-s2.0-84921631412&doi=10.1136%2fbcr-2014-207011&partnerID=40&md5=be1f1178a921d74d80db23695c89c870","Department of Neurology, Coimbra University Hospital, Coimbra, Portugal; Department of Neurology, Hospital de Faro, Faro, Portugal","Marques I.B., Department of Neurology, Coimbra University Hospital, Coimbra, Portugal; Tábuas-Pereira M., Department of Neurology, Coimbra University Hospital, Coimbra, Portugal; Milheiro M., Department of Neurology, Hospital de Faro, Faro, Portugal; Santana I., Department of Neurology, Coimbra University Hospital, Coimbra, Portugal","","","BMJ Publishing Group","1757790X","","","25564588","English","BMJ Case Rep.","Article","Final","All Open Access; Green Open Access","Scopus","2-s2.0-84921631412"
"Simchovitz A.; Heneka M.T.; Soreq H.","Simchovitz, Alon (56088505200); Heneka, Michael T. (7003653109); Soreq, Hermona (35464534500)","56088505200; 7003653109; 35464534500","Personalized genetics of the cholinergic blockade of neuroinflammation","2017","Journal of Neurochemistry","142","","","178","187","9","30","10.1111/jnc.13928","https://www.scopus.com/inward/record.uri?eid=2-s2.0-85016576152&doi=10.1111%2fjnc.13928&partnerID=40&md5=f4528dd64097bc177a4c74befa0568d7","Department of Biological Chemistry, The Hebrew University of Jerusalem, Givat Ram, Jerusalem, Israel; Department of Neurology, University Bonn, Bonn, Germany","Simchovitz A., Department of Biological Chemistry, The Hebrew University of Jerusalem, Givat Ram, Jerusalem, Israel; Heneka M.T., Department of Neurology, University Bonn, Bonn, Germany; Soreq H., Department of Biological Chemistry, The Hebrew University of Jerusalem, Givat Ram, Jerusalem, Israel","H. Soreq; Department of Biological Chemistry, The Hebrew University of Jerusalem, Givat Ram, Israel; email: soreq@cc.huji.ac.il","","Blackwell Publishing Ltd","00223042","","JONRA","28326544","English","J. Neurochem.","Review","Final","All Open Access; Green Open Access; Hybrid Gold Open Access","Scopus","2-s2.0-85016576152"
"Tomassoni D.; Catalani A.; Cinque C.; di Tullio M.A.; Tayebati S.K.; Cadoni A.; Nwankwo I.E.; Traini E.; Amenta F.","Tomassoni, Daniele (6602558285); Catalani, Assia (6701375647); Cinque, Carlo (6603055636); di Tullio, Maria Antonietta (7006671907); Tayebati, Seyed Khosrow (7003644539); Cadoni, Angela (7003451982); Nwankwo, Innocent Ejike (24605861600); Traini, Enea (23037157400); Amenta, Francesco (35594184800)","6602558285; 6701375647; 6603055636; 7006671907; 7003644539; 7003451982; 24605861600; 23037157400; 35594184800","Effects of cholinergic enhancing drugs on cholinergic transporters in the brain and peripheral blood lymphocytes of spontaneously hypertensive rats","2012","Current Alzheimer Research","9","1","","120","127","7","22","10.2174/156720512799015118","https://www.scopus.com/inward/record.uri?eid=2-s2.0-84856480097&doi=10.2174%2f156720512799015118&partnerID=40&md5=f81c205ca9ec4c274fedb06ef48dfc6c","Scuola di Bioscienze e Biotecnologie, Università di Camerino, Camerino, Italy; Dipartimento di Fisiologia e Farmacologia, Università La Sapienza, Roma, Italy; Anatomia Umana, Scienze del Farmaco e dei Prodotti della Salute, Università di Camerino, Camerino, Italy; Dipartimento di Medicina Sperimentale, Università di Genova, Genova, Italy","Tomassoni D., Scuola di Bioscienze e Biotecnologie, Università di Camerino, Camerino, Italy; Catalani A., Dipartimento di Fisiologia e Farmacologia, Università La Sapienza, Roma, Italy; Cinque C., Dipartimento di Fisiologia e Farmacologia, Università La Sapienza, Roma, Italy; di Tullio M.A., Anatomia Umana, Scienze del Farmaco e dei Prodotti della Salute, Università di Camerino, Camerino, Italy; Tayebati S.K., Anatomia Umana, Scienze del Farmaco e dei Prodotti della Salute, Università di Camerino, Camerino, Italy; Cadoni A., Dipartimento di Medicina Sperimentale, Università di Genova, Genova, Italy; Nwankwo I.E., Anatomia Umana, Scienze del Farmaco e dei Prodotti della Salute, Università di Camerino, Camerino, Italy; Traini E., Anatomia Umana, Scienze del Farmaco e dei Prodotti della Salute, Università di Camerino, Camerino, Italy; Amenta F., Anatomia Umana, Scienze del Farmaco e dei Prodotti della Salute, Università di Camerino, Camerino, Italy","D. Tomassoni; School of Bioscience and Biotechnology, University of Camerino, 62032 Camerino (MC), Via Gentile III da Varano, Italy; email: daniele.tomassoni@unicam.it","","","18755828","","","22191561","English","Curr. Alzheimer Res.","Article","Final","","Scopus","2-s2.0-84856480097"
"Islam B.U.; Tabrez S.","Islam, Badar ul (54581054600); Tabrez, Shams (6506355629)","54581054600; 6506355629","Management of Alzheimer's disease—An insight of the enzymatic and other novel potential targets","2017","International Journal of Biological Macromolecules","97","","","700","709","9","38","10.1016/j.ijbiomac.2017.01.076","https://www.scopus.com/inward/record.uri?eid=2-s2.0-85010403184&doi=10.1016%2fj.ijbiomac.2017.01.076&partnerID=40&md5=0e23116f37b485630aeba437835615ba","Department of Biochemistry, J. N. Medical College, Faculty of Medicine, Aligarh Muslim University, Aligarh, 202002, India; King Fahd Medical Research Center, King Abdulaziz University, P. O. Box 80216, Jeddah, 21589, Saudi Arabia","Islam B.U., Department of Biochemistry, J. N. Medical College, Faculty of Medicine, Aligarh Muslim University, Aligarh, 202002, India; Tabrez S., King Fahd Medical Research Center, King Abdulaziz University, P. O. Box 80216, Jeddah, 21589, Saudi Arabia","S. Tabrez; King Fahd Medical Research Center, King Abdulaziz University, Jeddah, P. O. Box 80216, 21589, Saudi Arabia; email: shamstabrez1@gmail.com","","Elsevier B.V.","01418130","","IJBMD","28111296","English","Int. J. Biol. Macromol.","Review","Final","","Scopus","2-s2.0-85010403184"
"Brouillette J.; Young D.; During M.J.; Quirion R.","Brouillette, Jonathan (36119593600); Young, Deborah (25935582800); During, Matthew J. (7005720022); Quirion, Rémi (56031971000)","36119593600; 25935582800; 7005720022; 56031971000","Hippocampal gene expression profiling reveals the possible involvement of Homer1 and GABAB receptors in scopolamine-induced amnesia","2007","Journal of Neurochemistry","102","6","","1978","1989","11","40","10.1111/j.1471-4159.2007.04666.x","https://www.scopus.com/inward/record.uri?eid=2-s2.0-34548211276&doi=10.1111%2fj.1471-4159.2007.04666.x&partnerID=40&md5=774a61fe64ec40195500d57f25c60450","Department of Neurology and Neurosurgery, Douglas Mental Health University Institute, McGill University, Montréal, Que., Canada; Department of Molecular Medicine and Pathology, University of Auckland, Auckland, New Zealand; Department of Psychiatry, Douglas Mental Health University Institute, McGill University, Montréal, Que., Canada; Douglas Hospital Research Centre, McGill University, Montréal, Que. H4H 1R3, 6875 LaSalle Boulevard, Canada","Brouillette J., Department of Neurology and Neurosurgery, Douglas Mental Health University Institute, McGill University, Montréal, Que., Canada; Young D., Department of Molecular Medicine and Pathology, University of Auckland, Auckland, New Zealand; During M.J., Department of Molecular Medicine and Pathology, University of Auckland, Auckland, New Zealand; Quirion R., Department of Neurology and Neurosurgery, Douglas Mental Health University Institute, McGill University, Montréal, Que., Canada, Department of Psychiatry, Douglas Mental Health University Institute, McGill University, Montréal, Que., Canada, Douglas Hospital Research Centre, McGill University, Montréal, Que. H4H 1R3, 6875 LaSalle Boulevard, Canada","R. Quirion; Douglas Hospital Research Centre, McGill University, Montréal, Que. H4H 1R3, 6875 LaSalle Boulevard, Canada; email: remi.quirion@douglas.mcgill.ca","","","14714159","","JONRA","17540011","English","J. Neurochem.","Article","Final","All Open Access; Bronze Open Access","Scopus","2-s2.0-34548211276"
"Jensen L.T.; Møller T.H.; Larsen S.A.; Jakobsen H.; Olsen A.","Jensen, Louise T. (23492275400); Møller, Tine H. (54584184300); Larsen, Simon A. (54583948200); Jakobsen, Helle (16637047800); Olsen, Anders (7202795621)","23492275400; 54584184300; 54583948200; 16637047800; 7202795621","A new role for laminins as modulators of protein toxicity in Caenorhabditis elegans","2012","Aging Cell","11","1","","82","92","10","8","10.1111/j.1474-9726.2011.00767.x","https://www.scopus.com/inward/record.uri?eid=2-s2.0-84855827624&doi=10.1111%2fj.1474-9726.2011.00767.x&partnerID=40&md5=3cb142c86f6da1e0d5268c7630a49a62","Department of Molecular Biology and Genetics, Aarhus University, DK-8000 Aarhus C, Gustav Wieds Vej 10C, Denmark","Jensen L.T., Department of Molecular Biology and Genetics, Aarhus University, DK-8000 Aarhus C, Gustav Wieds Vej 10C, Denmark; Møller T.H., Department of Molecular Biology and Genetics, Aarhus University, DK-8000 Aarhus C, Gustav Wieds Vej 10C, Denmark; Larsen S.A., Department of Molecular Biology and Genetics, Aarhus University, DK-8000 Aarhus C, Gustav Wieds Vej 10C, Denmark; Jakobsen H., Department of Molecular Biology and Genetics, Aarhus University, DK-8000 Aarhus C, Gustav Wieds Vej 10C, Denmark; Olsen A., Department of Molecular Biology and Genetics, Aarhus University, DK-8000 Aarhus C, Gustav Wieds Vej 10C, Denmark","A. Olsen; Department of Molecular Biology and Genetics, Aarhus University, DK-8000 Aarhus C, Gustav Wieds Vej 10C, Denmark; email: ano@mb.au.dk","","","14749726","","ACGEC","22051349","English","Aging Cell","Article","Final","All Open Access; Hybrid Gold Open Access","Scopus","2-s2.0-84855827624"
