"Rathee S.; Sen D.; Pandey V.; Jain S.K.","Rathee, Sunny (58785272900); Sen, Debasis (59309066600); Pandey, Vishal (59308895700); Jain, Sanjay K. (57215304839)","58785272900; 59309066600; 59308895700; 57215304839","Advances in Understanding and Managing Alzheimer's Disease: From Pathophysiology to Innovative Therapeutic Strategies","2024","Current Drug Targets","25","11","","752","774","22","0","10.2174/0113894501320096240627071400","https://www.scopus.com/inward/record.uri?eid=2-s2.0-85202844071&doi=10.2174%2f0113894501320096240627071400&partnerID=40&md5=955231c2f5a1972102b807a5dc23aeb4","Department of Pharmaceutical Sciences, Dr. Harisingh Gour Vishwavidyalaya (A Central University), Madhya Pradesh, Sagar, 470003, India","Rathee S., Department of Pharmaceutical Sciences, Dr. Harisingh Gour Vishwavidyalaya (A Central University), Madhya Pradesh, Sagar, 470003, India; Sen D., Department of Pharmaceutical Sciences, Dr. Harisingh Gour Vishwavidyalaya (A Central University), Madhya Pradesh, Sagar, 470003, India; Pandey V., Department of Pharmaceutical Sciences, Dr. Harisingh Gour Vishwavidyalaya (A Central University), Madhya Pradesh, Sagar, 470003, India; Jain S.K., Department of Pharmaceutical Sciences, Dr. Harisingh Gour Vishwavidyalaya (A Central University), Madhya Pradesh, Sagar, 470003, India","S.K. Jain; Department of Pharmaceutical Sciences, Dr. Harisingh Gour Central University, Sagar, M.P,, 470003, India; email: drskjainin@gmail.com","","Bentham Science Publishers","13894501","","CDTUA","39039673","English","Curr. Drug Targets","Review","Final","","Scopus","2-s2.0-85202844071"
"Zhou S.; Li Z.; Liu P.; Wang S.; Zhao J.; Zhang G.","Zhou, Shengkai (57216566870); Li, Zhao (57216567803); Liu, Peng (57221090059); Wang, Sheng (57216567253); Zhao, Jian (57191637483); Zhang, Guobao (57195549529)","57216566870; 57216567803; 57221090059; 57216567253; 57191637483; 57195549529","Donepezil Prevents ox-LDL-Induced Attachment of THP-1 Monocytes to Human Aortic Endothelial Cells (HAECs)","2020","Chemical Research in Toxicology","33","4","","975","981","6","6","10.1021/acs.chemrestox.9b00509","https://www.scopus.com/inward/record.uri?eid=2-s2.0-85083909002&doi=10.1021%2facs.chemrestox.9b00509&partnerID=40&md5=c1436686b7dc5ff2e48c6a6e5cde6e2f","Department of Cardiovascular Surgery, Central China Fuwai Hospital, Central China Fuwai Hospital of Zhengzhou University, Henan Provincial People's Hospital, Zhengzhou, 451464, China","Zhou S., Department of Cardiovascular Surgery, Central China Fuwai Hospital, Central China Fuwai Hospital of Zhengzhou University, Henan Provincial People's Hospital, Zhengzhou, 451464, China; Li Z., Department of Cardiovascular Surgery, Central China Fuwai Hospital, Central China Fuwai Hospital of Zhengzhou University, Henan Provincial People's Hospital, Zhengzhou, 451464, China; Liu P., Department of Cardiovascular Surgery, Central China Fuwai Hospital, Central China Fuwai Hospital of Zhengzhou University, Henan Provincial People's Hospital, Zhengzhou, 451464, China; Wang S., Department of Cardiovascular Surgery, Central China Fuwai Hospital, Central China Fuwai Hospital of Zhengzhou University, Henan Provincial People's Hospital, Zhengzhou, 451464, China; Zhao J., Department of Cardiovascular Surgery, Central China Fuwai Hospital, Central China Fuwai Hospital of Zhengzhou University, Henan Provincial People's Hospital, Zhengzhou, 451464, China; Zhang G., Department of Cardiovascular Surgery, Central China Fuwai Hospital, Central China Fuwai Hospital of Zhengzhou University, Henan Provincial People's Hospital, Zhengzhou, 451464, China","G. Zhang; Department of Cardiovascular Surgery, Central China Fuwai Hospital, Central China Fuwai Hospital of Zhengzhou University, Henan Provincial People's Hospital, Zhengzhou, 451464, China; email: drzhanggb717@163.com","","American Chemical Society","0893228X","","CRTOE","32174113","English","Chem. Res. Toxicol.","Article","Final","","Scopus","2-s2.0-85083909002"
"Dymek A.; Mroczek T.","Dymek, Aleksandra (57219288706); Mroczek, Tomasz (57076234700)","57219288706; 57076234700","Methods of isolation and bioactivity of alkaloids obtained from selected species belonging to the Amaryllidaceae and Lycopodiaceae families","2021","Current Issues in Pharmacy and Medical Sciences","34","2","","81","86","5","2","10.2478/cipms-2021-0016","https://www.scopus.com/inward/record.uri?eid=2-s2.0-85110534716&doi=10.2478%2fcipms-2021-0016&partnerID=40&md5=80d16deb6df7ee5261dc7258180a494a","Independent Laboratory of Chemistry of Natural Products, Chair of Pharmacognosy, Medical University of Lublin, Poland","Dymek A., Independent Laboratory of Chemistry of Natural Products, Chair of Pharmacognosy, Medical University of Lublin, Poland; Mroczek T., Independent Laboratory of Chemistry of Natural Products, Chair of Pharmacognosy, Medical University of Lublin, Poland","A. Dymek; Independent Laboratory of Chemistry of Natural Products, Chair of Pharmacognosy, Medical University of Lublin, Poland; email: aleksandra.dymek91@interia.pl","","Sciendo","2084980X","","","","English","Curr. Issues Pharma. Med. Sci.","Article","Final","All Open Access; Gold Open Access","Scopus","2-s2.0-85110534716"
"Ali M.; Saleem U.; Anwar F.; Imran M.; Nadeem H.; Ahmad B.; Ali T.; Atta-ur-rehman; Ismail T.","Ali, Meissam (57221690918); Saleem, Uzma (55626217900); Anwar, Fareeha (57196278071); Imran, Muhammad (57211658314); Nadeem, Humaira (6507108099); Ahmad, Bashir (55639631000); Ali, Tahir (57209325908); Atta-ur-rehman (56682583600); Ismail, Tariq (57200662595)","57221690918; 55626217900; 57196278071; 57211658314; 6507108099; 55639631000; 57209325908; 56682583600; 57200662595","Screening of Synthetic Isoxazolone Derivative Role in Alzheimer’s Disease: Computational and Pharmacological Approach","2021","Neurochemical Research","46","4","","905","920","15","18","10.1007/s11064-021-03229-w","https://www.scopus.com/inward/record.uri?eid=2-s2.0-85099874296&doi=10.1007%2fs11064-021-03229-w&partnerID=40&md5=e0fcd7ecf482d2c140507c18424353cd","Riphah Institute of Pharmaceutical Sciences, Riphah International University, Lahore Campus, 54000, Pakistan; Faculty of Pharmaceutical Sciences, Government College University, Faisalabad, 38000, Pakistan; Riphah Institute of Pharmaceutical Sciences, Riphah International University, Islamabad, 44000, Pakistan; Department of Pharmacy, Faculty of Natural Sciences, Forman Chirstian College University, Ferozpur Road, Lahore, 54600, Pakistan; Department of Pharmacy, COMSATS University, Abbottabad, 22060, Pakistan","Ali M., Riphah Institute of Pharmaceutical Sciences, Riphah International University, Lahore Campus, 54000, Pakistan; Saleem U., Faculty of Pharmaceutical Sciences, Government College University, Faisalabad, 38000, Pakistan; Anwar F., Riphah Institute of Pharmaceutical Sciences, Riphah International University, Lahore Campus, 54000, Pakistan; Imran M., Riphah Institute of Pharmaceutical Sciences, Riphah International University, Islamabad, 44000, Pakistan; Nadeem H., Riphah Institute of Pharmaceutical Sciences, Riphah International University, Islamabad, 44000, Pakistan; Ahmad B., Riphah Institute of Pharmaceutical Sciences, Riphah International University, Lahore Campus, 54000, Pakistan; Ali T., Riphah Institute of Pharmaceutical Sciences, Riphah International University, Lahore Campus, 54000, Pakistan; Atta-ur-rehman, Department of Pharmacy, Faculty of Natural Sciences, Forman Chirstian College University, Ferozpur Road, Lahore, 54600, Pakistan; Ismail T., Department of Pharmacy, COMSATS University, Abbottabad, 22060, Pakistan","F. Anwar; Riphah Institute of Pharmaceutical Sciences, Riphah International University, Lahore Campus, 54000, Pakistan; email: fareeha.anwar@riphah.edu.pk","","Springer","03643190","","NERED","33486698","English","Neurochem. Res.","Article","Final","","Scopus","2-s2.0-85099874296"
"Amat-Ur-rasool H.; Ahmed M.; Hasnain S.; Carter W.G.","Amat-Ur-rasool, Hafsa (56556944400); Ahmed, Mehboob (55463603700); Hasnain, Shahida (7102767938); Carter, Wayne G. (7202493897)","56556944400; 55463603700; 7102767938; 7202493897","Anti-cholinesterase combination drug therapy as a potential treatment for alzheimer’s disease","2021","Brain Sciences","11","2","184","1","12","11","23","10.3390/brainsci11020184","https://www.scopus.com/inward/record.uri?eid=2-s2.0-85101064386&doi=10.3390%2fbrainsci11020184&partnerID=40&md5=5c2f833941c95ac60bdc3caff257e58f","Royal Derby Hospital Centre, School of Medicine, University of Nottingham, Derby, DE22 3DT, United Kingdom; Department of Microbiology and Molecular Genetics, University of the Punjab, Lahore, 54590, Pakistan","Amat-Ur-rasool H., Royal Derby Hospital Centre, School of Medicine, University of Nottingham, Derby, DE22 3DT, United Kingdom, Department of Microbiology and Molecular Genetics, University of the Punjab, Lahore, 54590, Pakistan; Ahmed M., Department of Microbiology and Molecular Genetics, University of the Punjab, Lahore, 54590, Pakistan; Hasnain S., Department of Microbiology and Molecular Genetics, University of the Punjab, Lahore, 54590, Pakistan; Carter W.G., Royal Derby Hospital Centre, School of Medicine, University of Nottingham, Derby, DE22 3DT, United Kingdom","W.G. Carter; Royal Derby Hospital Centre, School of Medicine, University of Nottingham, Derby, DE22 3DT, United Kingdom; email: wayne.carter@nottingham.ac.uk","","MDPI AG","20763425","","","","English","Brain Sci.","Article","Final","All Open Access; Gold Open Access","Scopus","2-s2.0-85101064386"
"Desgagné-Penix I.","Desgagné-Penix, Isabel (16635671000)","16635671000","Biosynthesis of alkaloids in Amaryllidaceae plants: a review","2021","Phytochemistry Reviews","20","2","","409","431","22","69","10.1007/s11101-020-09678-5","https://www.scopus.com/inward/record.uri?eid=2-s2.0-85085026698&doi=10.1007%2fs11101-020-09678-5&partnerID=40&md5=4d838ca224787522fa13eb8c50d1ea3b","Department of Chemistry, Biochemistry and Physics, Université du Québec à Trois-Rivières, 3351 boulevard des Forges, Trois-Rivières, G9A 5H7, QC, Canada","Desgagné-Penix I., Department of Chemistry, Biochemistry and Physics, Université du Québec à Trois-Rivières, 3351 boulevard des Forges, Trois-Rivières, G9A 5H7, QC, Canada","I. Desgagné-Penix; Department of Chemistry, Biochemistry and Physics, Université du Québec à Trois-Rivières, Trois-Rivières, 3351 boulevard des Forges, G9A 5H7, Canada; email: Isabel.Desgagne-Penix@uqtr.ca","","Springer Science and Business Media B.V.","15687767","","PRHEB","","English","Phytochem. Rev.","Review","Final","","Scopus","2-s2.0-85085026698"
"Papakyriakopoulou P.; Valsami G.; Dev K.K.","Papakyriakopoulou, Paraskevi (57219731654); Valsami, Georgia (6603233676); Dev, Kumlesh K. (7004135414)","57219731654; 6603233676; 7004135414","The Effect of Donepezil Hydrochloride in the Twitcher Mouse Model of Krabbe Disease","2024","Molecular Neurobiology","61","11","","8688","8701","13","0","10.1007/s12035-024-04137-0","https://www.scopus.com/inward/record.uri?eid=2-s2.0-85189078587&doi=10.1007%2fs12035-024-04137-0&partnerID=40&md5=4978853f2abfbaba0afdda098117d3ce","Drug Development, Department of Physiology, School of Medicine, Trinity College Dublin, Dublin 2, Ireland; Laboratory of Biopharmaceutics and Pharmacokinetics, Department of Pharmacy, National and Kapodistrian University of Athens, Zografou, 15784, Greece","Papakyriakopoulou P., Drug Development, Department of Physiology, School of Medicine, Trinity College Dublin, Dublin 2, Ireland, Laboratory of Biopharmaceutics and Pharmacokinetics, Department of Pharmacy, National and Kapodistrian University of Athens, Zografou, 15784, Greece; Valsami G., Laboratory of Biopharmaceutics and Pharmacokinetics, Department of Pharmacy, National and Kapodistrian University of Athens, Zografou, 15784, Greece; Dev K.K., Drug Development, Department of Physiology, School of Medicine, Trinity College Dublin, Dublin 2, Ireland","K.K. Dev; Drug Development, Department of Physiology, School of Medicine, Trinity College Dublin, Dublin 2, Ireland; email: devk@tcd.ie; G. Valsami; Laboratory of Biopharmaceutics and Pharmacokinetics, Department of Pharmacy, National and Kapodistrian University of Athens, Zografou, 15784, Greece; email: valsami@pharm.uoa.gr","","Springer","08937648","","MONBE","38558359","English","Mol. Neurobiol.","Article","Final","All Open Access; Hybrid Gold Open Access","Scopus","2-s2.0-85189078587"
"Pamio M.V.; Trevisan C.; Pigozzo S.; De Rui M.; Devita M.; Girardi A.; Manzato E.; Sergi G.; Coin A.","Pamio, Maria V. (57076902100); Trevisan, Caterina (57130345100); Pigozzo, Sabrina (6508140243); De Rui, Marina (42261418600); Devita, Maria (57191953206); Girardi, Agostino (35344861100); Manzato, Enzo (24547168700); Sergi, Giuseppe (7004676852); Coin, Alessandra (6601961267)","57076902100; 57130345100; 6508140243; 42261418600; 57191953206; 35344861100; 24547168700; 7004676852; 6601961267","Are cytochrome P4502D6 and apolipoprotein E genotypes associated with long-term cognitive and functional changes in patients treated with donepezil?","2020","Psychogeriatrics","20","5","","578","584","6","1","10.1111/psyg.12547","https://www.scopus.com/inward/record.uri?eid=2-s2.0-85083286370&doi=10.1111%2fpsyg.12547&partnerID=40&md5=784908336af8deee4cab17f5953b01f0","Department of Medicine (DIMED), Geriatrics Division, University of Padua, Padua, Italy; National Research Council, Neuroscience Institute, Padua, Italy","Pamio M.V., Department of Medicine (DIMED), Geriatrics Division, University of Padua, Padua, Italy; Trevisan C., Department of Medicine (DIMED), Geriatrics Division, University of Padua, Padua, Italy; Pigozzo S., Department of Medicine (DIMED), Geriatrics Division, University of Padua, Padua, Italy; De Rui M., Department of Medicine (DIMED), Geriatrics Division, University of Padua, Padua, Italy; Devita M., Department of Medicine (DIMED), Geriatrics Division, University of Padua, Padua, Italy; Girardi A., Department of Medicine (DIMED), Geriatrics Division, University of Padua, Padua, Italy; Manzato E., Department of Medicine (DIMED), Geriatrics Division, University of Padua, Padua, Italy, National Research Council, Neuroscience Institute, Padua, Italy; Sergi G., Department of Medicine (DIMED), Geriatrics Division, University of Padua, Padua, Italy; Coin A., Department of Medicine (DIMED), Geriatrics Division, University of Padua, Padua, Italy","C. Trevisan; Department of Medicine (DIMED), Geriatrics Division, University of Padua, Padua, Italy; email: caterina.trevisan.5@phd.unipd.it","","Blackwell Publishing Ltd","13463500","","PSYCH","32237281","English","Psychogeriatrics","Article","Final","","Scopus","2-s2.0-85083286370"
"Erdogan Orhan I.; Deniz F.S.S.; Salmas R.E.; Irmak S.; Acar O.O.; Turgut G.C.; Sen A.; Zbancioc A.-M.; Luca S.V.; Skiba A.; Skalicka-Woźniak K.; Tataringa G.","Erdogan Orhan, Ilkay (7004467864); Deniz, F. Sezer Senol (26428948100); Salmas, Ramin Ekhteiari (56338023600); Irmak, Sule (57991468300); Acar, Ozden Ozgun (57211402404); Turgut, Gurbet Celik (57192670850); Sen, Alaattin (7401592711); Zbancioc, Ana-Maria (35932933400); Luca, Simon Vlad (57210375123); Skiba, Adrianna (57202221407); Skalicka-Woźniak, Krystyna (24765731300); Tataringa, Gabriela (14021846100)","7004467864; 26428948100; 56338023600; 57991468300; 57211402404; 57192670850; 7401592711; 35932933400; 57210375123; 57202221407; 24765731300; 14021846100","Evaluation of Anti-Alzheimer Activity of Synthetic Coumarins by Combination of in Vitro and in Silico Approaches","2022","Chemistry and Biodiversity","19","12","e202200315","","","","2","10.1002/cbdv.202200315","https://www.scopus.com/inward/record.uri?eid=2-s2.0-85143230188&doi=10.1002%2fcbdv.202200315&partnerID=40&md5=f3abde0368a30bf0af680d86acd3c3e1","Department of Pharmacognosy, Faculty of Pharmacy, Gazi University, Ankara, 06330, Turkey; Department of Chemistry, Britannia House, King's College London, London, SE1 1DB, United Kingdom; Pamukkale University, Faculty of Arts & Sciences, Department of Biology, Denizli, 20070, Turkey; Pamukkale University, Seed Breeding & Genetics Application Research Center, Denizli, 20070, Turkey; Pamukkale University, Faculty of Applied Sciences, Organic Agriculture Management, Denizli, Civril, 20680, Turkey; Abdullah Gul University, Faculty of Life and Natural Sciences, Department of Molecular Biology and Genetics, Kayseri, 38080, Turkey; University of Medicine and Pharmacy Grigore T. Popa Iasi, Faculty of Pharmacy, Romania; Biothermodynamics, TUM School of Life Sciences, Technical University of Munich, Freising, 85354, Germany; Department of Natural Products Chemistry, Medical University of Lublin, Lublin, 20-093, Poland","Erdogan Orhan I., Department of Pharmacognosy, Faculty of Pharmacy, Gazi University, Ankara, 06330, Turkey; Deniz F.S.S., Department of Pharmacognosy, Faculty of Pharmacy, Gazi University, Ankara, 06330, Turkey; Salmas R.E., Department of Chemistry, Britannia House, King's College London, London, SE1 1DB, United Kingdom; Irmak S., Pamukkale University, Faculty of Arts & Sciences, Department of Biology, Denizli, 20070, Turkey; Acar O.O., Pamukkale University, Seed Breeding & Genetics Application Research Center, Denizli, 20070, Turkey; Turgut G.C., Pamukkale University, Faculty of Applied Sciences, Organic Agriculture Management, Denizli, Civril, 20680, Turkey; Sen A., Pamukkale University, Faculty of Arts & Sciences, Department of Biology, Denizli, 20070, Turkey, Abdullah Gul University, Faculty of Life and Natural Sciences, Department of Molecular Biology and Genetics, Kayseri, 38080, Turkey; Zbancioc A.-M., University of Medicine and Pharmacy Grigore T. Popa Iasi, Faculty of Pharmacy, Romania; Luca S.V., Biothermodynamics, TUM School of Life Sciences, Technical University of Munich, Freising, 85354, Germany; Skiba A., Department of Natural Products Chemistry, Medical University of Lublin, Lublin, 20-093, Poland; Skalicka-Woźniak K., Department of Natural Products Chemistry, Medical University of Lublin, Lublin, 20-093, Poland; Tataringa G., University of Medicine and Pharmacy Grigore T. Popa Iasi, Faculty of Pharmacy, Romania","K. Skalicka-Woźniak; Department of Natural Products Chemistry, Medical University of Lublin, Lublin, 20-093, Poland; email: kskalicka@pharmacognosy.org","","John Wiley and Sons Inc","16121872","","CBHIA","36282001","English","Chem. Biodiversity","Article","Final","","Scopus","2-s2.0-85143230188"
"Chien C.-F.; Huang L.-C.; Li K.-Y.; Yang Y.-H.","Chien, Ching-Fang (57195531424); Huang, Ling-Chun (55989842100); Li, Kuan-Ying (57216969302); Yang, Yuan-Han (36132623000)","57195531424; 55989842100; 57216969302; 36132623000","Cognitive effects of cilostazol in Alzheimer's dementia patients with peripheral arterial occlusive disease: A case–control study","2023","Geriatrics and Gerontology International","23","3","","194","199","5","2","10.1111/ggi.14542","https://www.scopus.com/inward/record.uri?eid=2-s2.0-85147042926&doi=10.1111%2fggi.14542&partnerID=40&md5=b72ba40d47cccd67d92899ddc91689ac","Department of Neurology, Kaohsiung Medical University Hospital, Kaohsiung Medical University, Kaohsiung, Taiwan; Neuroscience Research Center, Kaohsiung Medical University, Kaohsiung, Taiwan; Department of Neurology, Kaohsiung Municipal Ta-Tung Hospital, Kaohsiung Medical University Hospital, Kaohsiung, Taiwan; School of Post-Baccalaureate Medicine, College of Medicine, Kaohsiung Medical University, Kaohsiung, Taiwan","Chien C.-F., Department of Neurology, Kaohsiung Medical University Hospital, Kaohsiung Medical University, Kaohsiung, Taiwan, Neuroscience Research Center, Kaohsiung Medical University, Kaohsiung, Taiwan, Department of Neurology, Kaohsiung Municipal Ta-Tung Hospital, Kaohsiung Medical University Hospital, Kaohsiung, Taiwan; Huang L.-C., Department of Neurology, Kaohsiung Medical University Hospital, Kaohsiung Medical University, Kaohsiung, Taiwan, Neuroscience Research Center, Kaohsiung Medical University, Kaohsiung, Taiwan, Department of Neurology, Kaohsiung Municipal Ta-Tung Hospital, Kaohsiung Medical University Hospital, Kaohsiung, Taiwan; Li K.-Y., Department of Neurology, Kaohsiung Medical University Hospital, Kaohsiung Medical University, Kaohsiung, Taiwan, Neuroscience Research Center, Kaohsiung Medical University, Kaohsiung, Taiwan, Department of Neurology, Kaohsiung Municipal Ta-Tung Hospital, Kaohsiung Medical University Hospital, Kaohsiung, Taiwan; Yang Y.-H., Department of Neurology, Kaohsiung Medical University Hospital, Kaohsiung Medical University, Kaohsiung, Taiwan, Neuroscience Research Center, Kaohsiung Medical University, Kaohsiung, Taiwan, Department of Neurology, Kaohsiung Municipal Ta-Tung Hospital, Kaohsiung Medical University Hospital, Kaohsiung, Taiwan, School of Post-Baccalaureate Medicine, College of Medicine, Kaohsiung Medical University, Kaohsiung, Taiwan","Y.-H. Yang; Department of Neurology, Kaohsiung Medical University Hospital, Kaohsiung Medical University, Kaohsiung, Taiwan; email: endlessyhy@gmail.com","","John Wiley and Sons Inc","14441586","","","36682741","English","Geriatr. Gerontol. Int.","Article","Final","","Scopus","2-s2.0-85147042926"
"Ben Halla S.; Tazzite A.; Gazzaz B.; Dehbi H.; El Moutawakil B.","Ben Halla, Sara (57360034500); Tazzite, Amal (36096281800); Gazzaz, Bouchaïb (35185971500); Dehbi, Hind (24334521000); El Moutawakil, Bouchra (8987640900)","57360034500; 36096281800; 35185971500; 24334521000; 8987640900","The impact of ABCB1 gene polymorphism (C3435T) and its expression on response to Donepezil in Moroccan patients with Alzheimer's disease","2022","Gene Reports","26","","101443","","","","0","10.1016/j.genrep.2021.101443","https://www.scopus.com/inward/record.uri?eid=2-s2.0-85120474037&doi=10.1016%2fj.genrep.2021.101443&partnerID=40&md5=4f9166bd1affef51d894c6768a469881","Laboratory of Cellular and Molecular Pathology, Faculty of Medicine and Pharmacy, Hassan II University, Casablanca, Morocco; Genetics Analysis Institute, Royal Gendarmerie, Rabat, Morocco; Laboratory of Medical Genetics, IBN ROCHD University Hospital, Casablanca, Morocco; Neurology Department, IBN ROCHD University Hospital, Casablanca, Morocco","Ben Halla S., Laboratory of Cellular and Molecular Pathology, Faculty of Medicine and Pharmacy, Hassan II University, Casablanca, Morocco; Tazzite A., Laboratory of Cellular and Molecular Pathology, Faculty of Medicine and Pharmacy, Hassan II University, Casablanca, Morocco; Gazzaz B., Laboratory of Cellular and Molecular Pathology, Faculty of Medicine and Pharmacy, Hassan II University, Casablanca, Morocco, Genetics Analysis Institute, Royal Gendarmerie, Rabat, Morocco; Dehbi H., Laboratory of Cellular and Molecular Pathology, Faculty of Medicine and Pharmacy, Hassan II University, Casablanca, Morocco, Laboratory of Medical Genetics, IBN ROCHD University Hospital, Casablanca, Morocco; El Moutawakil B., Laboratory of Cellular and Molecular Pathology, Faculty of Medicine and Pharmacy, Hassan II University, Casablanca, Morocco, Neurology Department, IBN ROCHD University Hospital, Casablanca, Morocco","S. Ben Halla; Laboratory of Cellular and Molecular Pathology, Faculty of Medicine and Pharmacy, Hassan II University, Casablanca, B.P.: 9154, Morocco; email: sarabenhalla.fmpc@gmail.com","","Elsevier Inc.","24520144","","","","English","Gene Rep.","Article","Final","","Scopus","2-s2.0-85120474037"
"Meltzer H.Y.; Rajagopal L.; Matrisciano F.; Hao J.; Svensson K.A.; Huang M.","Meltzer, Herbert Y. (35351230800); Rajagopal, Lakshmi (36153468200); Matrisciano, Francesco (6506228680); Hao, Junliang (57193153409); Svensson, Kjell A. (7006729681); Huang, Mei (7404261104)","35351230800; 36153468200; 6506228680; 57193153409; 7006729681; 7404261104","The allosteric dopamine D1 receptor potentiator, DETQ, ameliorates subchronic phencyclidine-induced object recognition memory deficits and enhances cortical acetylcholine efflux in male humanized D1 receptor knock-in mice","2019","Behavioural Brain Research","361","","","139","150","11","21","10.1016/j.bbr.2018.12.006","https://www.scopus.com/inward/record.uri?eid=2-s2.0-85059346469&doi=10.1016%2fj.bbr.2018.12.006&partnerID=40&md5=82fd29ecbb4ef7c19cada8405e7d41ad","Department of Psychiatry and Behavioral Sciences, Northwestern Feinberg School of Medicine, Chicago, 60611, IL, United States; Discovery Chemistry, Lilly Research Laboratories, Eli Lilly & Co., Lilly Corporate Center, Indianapolis, 46285, IN, United States; Neuroscience Discovery, Lilly Research Laboratories, Eli Lilly & Co., Lilly Corporate Center, Indianapolis, 46285, IN, United States","Meltzer H.Y., Department of Psychiatry and Behavioral Sciences, Northwestern Feinberg School of Medicine, Chicago, 60611, IL, United States; Rajagopal L., Department of Psychiatry and Behavioral Sciences, Northwestern Feinberg School of Medicine, Chicago, 60611, IL, United States; Matrisciano F., Department of Psychiatry and Behavioral Sciences, Northwestern Feinberg School of Medicine, Chicago, 60611, IL, United States; Hao J., Discovery Chemistry, Lilly Research Laboratories, Eli Lilly & Co., Lilly Corporate Center, Indianapolis, 46285, IN, United States; Svensson K.A., Neuroscience Discovery, Lilly Research Laboratories, Eli Lilly & Co., Lilly Corporate Center, Indianapolis, 46285, IN, United States; Huang M., Department of Psychiatry and Behavioral Sciences, Northwestern Feinberg School of Medicine, Chicago, 60611, IL, United States","H.Y. Meltzer; Department of Psychiatry and Behavioral Sciences, Northwestern University Feinberg School of Medicine, Chicago, 303 E. Chicago Ave., Ward Building 12-104, 60611, United States; email: h-meltzer@northwestern.edu","","Elsevier B.V.","01664328","","BBRED","30521930","English","Behav. Brain Res.","Article","Final","","Scopus","2-s2.0-85059346469"
