"Galimberti D.; Scarpini E.","Galimberti, Daniela (6701617660); Scarpini, Elio (57210771033)","6701617660; 57210771033","Pioglitazone for the treatment of Alzheimer’s disease","2017","Expert Opinion on Investigational Drugs","26","1","","97","101","4","90","10.1080/13543784.2017.1265504","https://www.scopus.com/inward/record.uri?eid=2-s2.0-85002213759&doi=10.1080%2f13543784.2017.1265504&partnerID=40&md5=495b4bb69fbbee5d7cb75f0593f7d1eb","Neurology Unit, Department of Pathophysiology and Transplantation, University of Milan, Fondazione Cà Granda, IRCCS Ospedale Maggiore Policlinico, Milan, Italy","Galimberti D., Neurology Unit, Department of Pathophysiology and Transplantation, University of Milan, Fondazione Cà Granda, IRCCS Ospedale Maggiore Policlinico, Milan, Italy; Scarpini E., Neurology Unit, Department of Pathophysiology and Transplantation, University of Milan, Fondazione Cà Granda, IRCCS Ospedale Maggiore Policlinico, Milan, Italy","D. Galimberti; Neurology Unit, Department of Pathophysiology and Transplantation, University of Milan, Fondazione Cà Granda, IRCCS Ospedale Maggiore Policlinico, Milan, Italy; email: daniela.galimberti@unimi.it","","Taylor and Francis Ltd","13543784","","EOIDE","27885860","English","Expert Opin. Invest. Drugs","Article","Final","","Scopus","2-s2.0-85002213759"
"Campbell N.L.; Dexter P.; Perkins A.J.; Gao S.; Li L.; Skaar T.C.; Frame A.; Hendrie H.C.; Callahan C.M.; Boustani M.A.","Campbell, Noll L (18036473900); Dexter, Paul (35462614700); Perkins, Anthony J (7102761843); Gao, Sujuan (7403257748); Li, Lang (35272883700); Skaar, Todd C (35406903600); Frame, Amie (42661158400); Hendrie, Hugh C (7004923246); Callahan, Chris M (35378854900); Boustani, Malaz A (6701768359)","18036473900; 35462614700; 7102761843; 7403257748; 35272883700; 35406903600; 42661158400; 7004923246; 35378854900; 6701768359","Medication adherence and tolerability of Alzheimer's disease medications: study protocol for a randomized controlled trial.","2013","Trials","14","","125","","","","7","10.1186/1745-6215-14-125","https://www.scopus.com/inward/record.uri?eid=2-s2.0-84891677331&doi=10.1186%2f1745-6215-14-125&partnerID=40&md5=40a1b78435e6a5544e71148711feaf08","Department of Pharmacy Practice, Purdue University School of Pharmacy, 410 West 10th Street, West Lafayette, IN, United States","Campbell N.L., Department of Pharmacy Practice, Purdue University School of Pharmacy, 410 West 10th Street, West Lafayette, IN, United States; Dexter P.; Perkins A.J.; Gao S.; Li L.; Skaar T.C.; Frame A.; Hendrie H.C.; Callahan C.M.; Boustani M.A.","N.L. Campbell; email: campbenl@iupui.edu","","","17456215","","","23782591","English","Trials","Article","Final","All Open Access; Gold Open Access","Scopus","2-s2.0-84891677331"
"Fernandez M.; Caballero J.; Fernandez L.; Sarai A.","Fernandez, Michael (57199901530); Caballero, Julio (8314999100); Fernandez, Leyden (14022695000); Sarai, Akinori (7006509318)","57199901530; 8314999100; 14022695000; 7006509318","Genetic algorithm optimization in drug design QSAR: Bayesian-regularized genetic neural networks (BRGNN) and genetic algorithm-optimized support vectors machines (GA-SVM)","2011","Molecular Diversity","15","1","","269","289","20","87","10.1007/s11030-010-9234-9","https://www.scopus.com/inward/record.uri?eid=2-s2.0-79953327578&doi=10.1007%2fs11030-010-9234-9&partnerID=40&md5=141b0664b4561bdd0fb66c1378586c2c","Department of Bioscience and Bioinformatics, Kyushu Institute of Technology (KIT), Iizuka 820-8502, 680-4 Kawazu, Japan; Centro de Bioinformatica Y Simulacion Molecular, Universidad de Talca, Talca, 2 Norte 685, Casilla 721, Chile; Barcelona Supercomputing Center, Centro Nacional de Supercomputación, Nexus II Building, 08034 Barcelona, c/ Jordi Girona, 29, Spain","Fernandez M., Department of Bioscience and Bioinformatics, Kyushu Institute of Technology (KIT), Iizuka 820-8502, 680-4 Kawazu, Japan; Caballero J., Centro de Bioinformatica Y Simulacion Molecular, Universidad de Talca, Talca, 2 Norte 685, Casilla 721, Chile; Fernandez L., Barcelona Supercomputing Center, Centro Nacional de Supercomputación, Nexus II Building, 08034 Barcelona, c/ Jordi Girona, 29, Spain; Sarai A., Department of Bioscience and Bioinformatics, Kyushu Institute of Technology (KIT), Iizuka 820-8502, 680-4 Kawazu, Japan","M. Fernandez; Department of Bioscience and Bioinformatics, Kyushu Institute of Technology (KIT), Iizuka 820-8502, 680-4 Kawazu, Japan; email: michael_llamosa@yahoo.com","","","13811991","","MODIF","20306130","English","Mol. Diversity","Review","Final","","Scopus","2-s2.0-79953327578"
"Sharma A.; Bemis M.; Desilets A.R.","Sharma, Alok (57195257648); Bemis, Marc (56275467700); Desilets, Alicia R. (19933426900)","57195257648; 56275467700; 19933426900","Role of medium chain triglycerides (Axona®) in the treatment of mild to moderate alzheimer's disease","2014","American Journal of Alzheimer's Disease and other Dementias","29","5","","409","414","5","45","10.1177/1533317513518650","https://www.scopus.com/inward/record.uri?eid=2-s2.0-84904413178&doi=10.1177%2f1533317513518650&partnerID=40&md5=f42536c4ec20f7b271f05b545daa7bb6","School of Pharmacy Worcester/Manchester, Department of Pharmaceutical Sciences, MCPHS University, Manchester, NH 03101, 1260 Elm Street, United States; Concord Hospital, Concord, NH, United States","Sharma A., School of Pharmacy Worcester/Manchester, Department of Pharmaceutical Sciences, MCPHS University, Manchester, NH 03101, 1260 Elm Street, United States; Bemis M., School of Pharmacy Worcester/Manchester, Department of Pharmaceutical Sciences, MCPHS University, Manchester, NH 03101, 1260 Elm Street, United States; Desilets A.R., Concord Hospital, Concord, NH, United States","A. Sharma; School of Pharmacy Worcester/Manchester, Department of Pharmaceutical Sciences, MCPHS University, Manchester, NH 03101, 1260 Elm Street, United States; email: alok.sharma@mcphs.edu","","SAGE Publications Inc.","15333175","","AJADC","24413538","English","Am. J. Alzheimer's Dis. Other Dem.","Review","Final","All Open Access; Hybrid Gold Open Access","Scopus","2-s2.0-84904413178"
"Klein J.","Klein, Jochen (7404604441)","7404604441","Phenserine","2007","Expert Opinion on Investigational Drugs","16","7","","1087","1097","10","70","10.1517/13543784.16.7.1087","https://www.scopus.com/inward/record.uri?eid=2-s2.0-34447529139&doi=10.1517%2f13543784.16.7.1087&partnerID=40&md5=ff81a35bd157720fe762af571cc49b13","University of Frankfurt College of Pharmacy, Biocenter N260, D-60438 Frankfurt, Max-von-Laue-Str. 9, Germany; TTUHSC School of Pharmacy, Department of Pharmaceutical Sciences, Amarillo, TX 79106, 1300 Coulter Drive, United States","Klein J., University of Frankfurt College of Pharmacy, Biocenter N260, D-60438 Frankfurt, Max-von-Laue-Str. 9, Germany, TTUHSC School of Pharmacy, Department of Pharmaceutical Sciences, Amarillo, TX 79106, 1300 Coulter Drive, United States","J. Klein; University of Frankfurt College of Pharmacy, Biocenter N260, D-60438 Frankfurt, Max-von-Laue-Str. 9, Germany; email: Klein@em.uni-frankfurt.de","","","13543784","","EOIDE","17594192","English","Expert Opin. Invest. Drugs","Article","Final","","Scopus","2-s2.0-34447529139"
"Imamura O.; Arai M.; Dateki M.; Takishima K.","Imamura, Osamu (57033921800); Arai, Masaaki (7402957508); Dateki, Minori (6507844425); Takishima, Kunio (7003507627)","57033921800; 7402957508; 6507844425; 7003507627","Donepezil promotes differentiation of neural stem cells into mature oligodendrocytes at the expense of astrogenesis","2017","Journal of Neurochemistry","140","2","","231","244","13","19","10.1111/jnc.13856","https://www.scopus.com/inward/record.uri?eid=2-s2.0-84991688012&doi=10.1111%2fjnc.13856&partnerID=40&md5=0383e33eb82fd1f648dea52c03ba2aa1","Department of Biochemistry, National Defense Medical College, Tokorozawa, Japan","Imamura O., Department of Biochemistry, National Defense Medical College, Tokorozawa, Japan; Arai M., Department of Biochemistry, National Defense Medical College, Tokorozawa, Japan; Dateki M., Department of Biochemistry, National Defense Medical College, Tokorozawa, Japan; Takishima K., Department of Biochemistry, National Defense Medical College, Tokorozawa, Japan","O. Imamura; Department of Biochemistry, National Defense Medical College, Tokorozawa, Japan; email: osamui@ndmc.ac.jp","","Blackwell Publishing Ltd","00223042","","JONRA","27664791","English","J. Neurochem.","Article","Final","All Open Access; Bronze Open Access","Scopus","2-s2.0-84991688012"
"Yoon H.; Myung W.; Lim S.-W.; Kang H.S.; Kim S.; Won H.-H.; Carroll B.J.; Kim D.K.","Yoon, H. (36465947800); Myung, W. (37099034100); Lim, S.-W. (7404080908); Kang, H.S. (57219595147); Kim, S. (8961850200); Won, H.-H. (34573851600); Carroll, B.J. (7203083023); Kim, D.K. (34975444600)","36465947800; 37099034100; 7404080908; 57219595147; 8961850200; 34573851600; 7203083023; 34975444600","Association of the choline acetyltransferase gene with responsiveness to acetylcholinesterase inhibitors in alzheimer's disease","2015","Pharmacopsychiatry","48","3","","111","117","6","28","10.1055/s-0035-1545300","https://www.scopus.com/inward/record.uri?eid=2-s2.0-84939980952&doi=10.1055%2fs-0035-1545300&partnerID=40&md5=8ba7e325f18323fbed318c8be2933b54","Department of Psychiatry, Samsung Medical Center, Sungkyunkwan University School of Medicine, 81 Irwon-ro, Gangnam-gu Seoul, 135-710, South Korea; Center for Clinical Research, Samsung Biomedical Research Institute, Seoul, South Korea; SAIHST, Sungkyunkwan University School of Medicine, Seoul, South Korea; Biostatistics Team, Samsung Biomedical Research Institute, Seoul, South Korea; Pacific Behavioral Research Foundation, Carmel, CA, United States","Yoon H., Department of Psychiatry, Samsung Medical Center, Sungkyunkwan University School of Medicine, 81 Irwon-ro, Gangnam-gu Seoul, 135-710, South Korea; Myung W., Department of Psychiatry, Samsung Medical Center, Sungkyunkwan University School of Medicine, 81 Irwon-ro, Gangnam-gu Seoul, 135-710, South Korea; Lim S.-W., Center for Clinical Research, Samsung Biomedical Research Institute, Seoul, South Korea, SAIHST, Sungkyunkwan University School of Medicine, Seoul, South Korea; Kang H.S., Center for Clinical Research, Samsung Biomedical Research Institute, Seoul, South Korea; Kim S., Biostatistics Team, Samsung Biomedical Research Institute, Seoul, South Korea; Won H.-H., Center for Clinical Research, Samsung Biomedical Research Institute, Seoul, South Korea; Carroll B.J., Pacific Behavioral Research Foundation, Carmel, CA, United States; Kim D.K., Department of Psychiatry, Samsung Medical Center, Sungkyunkwan University School of Medicine, 81 Irwon-ro, Gangnam-gu Seoul, 135-710, South Korea","","","Georg Thieme Verlag","01763679","","PHRME","25730470","English","Pharmacopsychiatry","Article","Final","All Open Access; Bronze Open Access","Scopus","2-s2.0-84939980952"
"Martinelli-Boneschi F.; Giacalone G.; Magnani G.; Biella G.; Coppi E.; Santangelo R.; Brambilla P.; Esposito F.; Lupoli S.; Clerici F.; Benussi L.; Ghidoni R.; Galimberti D.; Squitti R.; Confaloni A.; Bruno G.; Pichler S.; Mayhaus M.; Riemenschneider M.; Mariani C.; Comi G.; Scarpini E.; Binetti G.; Forloni G.; Franceschi M.; Albani D.","Martinelli-Boneschi, Filippo (57202042750); Giacalone, Giacomo (37037407500); Magnani, Giuseppe (24496141800); Biella, Gloria (57196607105); Coppi, Elisabetta (56370374600); Santangelo, Roberto (57191567809); Brambilla, Paola (56664033300); Esposito, Federica (57218216740); Lupoli, Sara (26433631200); Clerici, Francesca (56013510400); Benussi, Luisa (7004507361); Ghidoni, Roberta (7005186567); Galimberti, Daniela (6701617660); Squitti, Rosanna (6603592473); Confaloni, Annamaria (6602313189); Bruno, Giuseppe (7202705363); Pichler, Sabrina (55567099200); Mayhaus, Manuel (6506690558); Riemenschneider, Matthias (57200672258); Mariani, Claudio (55810313900); Comi, Giancarlo (7201788288); Scarpini, Elio (57210771033); Binetti, Giuliano (35429391100); Forloni, Gianluigi (7005645883); Franceschi, Massimo (7004351220); Albani, Diego (6603839904)","57202042750; 37037407500; 24496141800; 57196607105; 56370374600; 57191567809; 56664033300; 57218216740; 26433631200; 56013510400; 7004507361; 7005186567; 6701617660; 6603592473; 6602313189; 7202705363; 55567099200; 6506690558; 57200672258; 55810313900; 7201788288; 57210771033; 35429391100; 7005645883; 7004351220; 6603839904","Pharmacogenomics in Alzheimer's disease: A genome-wide association study of response to cholinesterase inhibitors","2013","Neurobiology of Aging","34","6","","1711.e7","1711.e13","","38","10.1016/j.neurobiolaging.2012.12.008","https://www.scopus.com/inward/record.uri?eid=2-s2.0-84875240626&doi=10.1016%2fj.neurobiolaging.2012.12.008&partnerID=40&md5=30cb2a842cca4e5cf1578d92c6911a71","San Raffaele Scientific Institute, Division of Neuroscience, Laboratory of Genetics of Complex Neurological Disorders, Institute of Experimental Neurology (INSPE), Milan, Italy; Memory Clinic, Department of Neurology, Division of Neuroscience, San Raffaele Scientific Institute, Milan, Italy; Department of Neuroscience, Mario Negri Institute for Pharmacological Research, Milan, Italy; Department of Health Sciences, University of Milan, Milan, Italy; Center for Research and Treatment of Cognitive Dysfunctions, Institute of Clinical Neurology, Department of Biomedical and Clinical Sciences, Luigi Sacco Hospital, University of Milan, Milan, Italy; Proteomics Unit and NeuroBioGen Lab-Memory Clinic, IRCCS Istituto Centro San Giovanni di Dio-Fatebenefratelli, Brescia, Italy; Department of Pathophysiology and Transplantation, Dino Ferrari Center, University of Milan and Fondazione Cà Granda, IRCCS Ospedale Maggiore Policlinico, Milan, Italy; Department of Neuroscience, AFaR-Fatebenefratelli Hospital, Rome, Isola Tiberina, Italy; Department of Cell Biology and Neurosciences, Istituto Superiore di Sanità, Rome, Italy; Department of Neurology and Psychiatry, University of Rome Sapienza, Rome, Italy; Department of Psychiatry and Psychotherapy, Saarland University Hospital, Saarland University, Homburg, Germany; Department of Neurology, IRCCS Multimedica, Milan, Italy","Martinelli-Boneschi F., San Raffaele Scientific Institute, Division of Neuroscience, Laboratory of Genetics of Complex Neurological Disorders, Institute of Experimental Neurology (INSPE), Milan, Italy, Memory Clinic, Department of Neurology, Division of Neuroscience, San Raffaele Scientific Institute, Milan, Italy; Giacalone G., San Raffaele Scientific Institute, Division of Neuroscience, Laboratory of Genetics of Complex Neurological Disorders, Institute of Experimental Neurology (INSPE), Milan, Italy, Memory Clinic, Department of Neurology, Division of Neuroscience, San Raffaele Scientific Institute, Milan, Italy; Magnani G., Memory Clinic, Department of Neurology, Division of Neuroscience, San Raffaele Scientific Institute, Milan, Italy; Biella G., Department of Neuroscience, Mario Negri Institute for Pharmacological Research, Milan, Italy; Coppi E., Memory Clinic, Department of Neurology, Division of Neuroscience, San Raffaele Scientific Institute, Milan, Italy; Santangelo R., Memory Clinic, Department of Neurology, Division of Neuroscience, San Raffaele Scientific Institute, Milan, Italy; Brambilla P., San Raffaele Scientific Institute, Division of Neuroscience, Laboratory of Genetics of Complex Neurological Disorders, Institute of Experimental Neurology (INSPE), Milan, Italy; Esposito F., San Raffaele Scientific Institute, Division of Neuroscience, Laboratory of Genetics of Complex Neurological Disorders, Institute of Experimental Neurology (INSPE), Milan, Italy, Memory Clinic, Department of Neurology, Division of Neuroscience, San Raffaele Scientific Institute, Milan, Italy; Lupoli S., Department of Health Sciences, University of Milan, Milan, Italy; Clerici F., Center for Research and Treatment of Cognitive Dysfunctions, Institute of Clinical Neurology, Department of Biomedical and Clinical Sciences, Luigi Sacco Hospital, University of Milan, Milan, Italy; Benussi L., Proteomics Unit and NeuroBioGen Lab-Memory Clinic, IRCCS Istituto Centro San Giovanni di Dio-Fatebenefratelli, Brescia, Italy; Ghidoni R., Proteomics Unit and NeuroBioGen Lab-Memory Clinic, IRCCS Istituto Centro San Giovanni di Dio-Fatebenefratelli, Brescia, Italy; Galimberti D., Department of Pathophysiology and Transplantation, Dino Ferrari Center, University of Milan and Fondazione Cà Granda, IRCCS Ospedale Maggiore Policlinico, Milan, Italy; Squitti R., Department of Neuroscience, AFaR-Fatebenefratelli Hospital, Rome, Isola Tiberina, Italy; Confaloni A., Department of Cell Biology and Neurosciences, Istituto Superiore di Sanità, Rome, Italy; Bruno G., Department of Neurology and Psychiatry, University of Rome Sapienza, Rome, Italy; Pichler S., Department of Psychiatry and Psychotherapy, Saarland University Hospital, Saarland University, Homburg, Germany; Mayhaus M., Department of Psychiatry and Psychotherapy, Saarland University Hospital, Saarland University, Homburg, Germany; Riemenschneider M., Department of Psychiatry and Psychotherapy, Saarland University Hospital, Saarland University, Homburg, Germany; Mariani C., Center for Research and Treatment of Cognitive Dysfunctions, Institute of Clinical Neurology, Department of Biomedical and Clinical Sciences, Luigi Sacco Hospital, University of Milan, Milan, Italy; Comi G., San Raffaele Scientific Institute, Division of Neuroscience, Laboratory of Genetics of Complex Neurological Disorders, Institute of Experimental Neurology (INSPE), Milan, Italy, Memory Clinic, Department of Neurology, Division of Neuroscience, San Raffaele Scientific Institute, Milan, Italy; Scarpini E., Department of Pathophysiology and Transplantation, Dino Ferrari Center, University of Milan and Fondazione Cà Granda, IRCCS Ospedale Maggiore Policlinico, Milan, Italy; Binetti G., Proteomics Unit and NeuroBioGen Lab-Memory Clinic, IRCCS Istituto Centro San Giovanni di Dio-Fatebenefratelli, Brescia, Italy; Forloni G., Department of Neuroscience, Mario Negri Institute for Pharmacological Research, Milan, Italy; Franceschi M., Department of Neurology, IRCCS Multimedica, Milan, Italy; Albani D., Department of Neuroscience, Mario Negri Institute for Pharmacological Research, Milan, Italy","F. Martinelli-Boneschi; San Raffaele Scientific Institute, Division of Neuroscience, Laboratory of Genetics of Complex Neurological Disorder, Institute of Experimental Neurology (INSPE), Milan 20123, Via Olgettina 58, Italy; email: martinelli.filippo@hsr.it","","Elsevier Inc.","01974580","","NEAGD","","English","Neurobiol. Aging","Article","Final","","Scopus","2-s2.0-84875240626"
"Sokolow S.; Li X.; Chen L.; Taylor K.D.; Rotter J.I.; Rissman R.A.; Aisen P.S.; Apostolova L.G.","Sokolow, Sophie (6602301124); Li, Xiaohui (57216515050); Chen, Lucia (57200185347); Taylor, Kent D. (7403523428); Rotter, Jerome I. (56284453500); Rissman, Robert A. (6602191595); Aisen, Paul S. (35397403800); Apostolova, Liana G. (57202555891)","6602301124; 57216515050; 57200185347; 7403523428; 56284453500; 6602191595; 35397403800; 57202555891","Deleterious effect of butyrylcholinesterase K-variant in donepezil treatment of mild cognitive impairment","2017","Journal of Alzheimer's Disease","56","1","","229","237","8","28","10.3233/JAD-160562","https://www.scopus.com/inward/record.uri?eid=2-s2.0-85040073900&doi=10.3233%2fJAD-160562&partnerID=40&md5=37c38e7df4adc2c47bc8e44398e4a4f0","School of Nursing, University of California at Los Angeles, 700 Tiverton Avenue, Factor Bldg 5-238, Los Angeles, 90095-6919, CA, United States; Brain Research Institute, University of California at Los Angeles, Los Angeles, CA, United States; Institute for Translational Genomics and Population Sciences, Department of Pediatrics, Los Angeles Biomedical Research Institute, Harbor-UCLA Medical Center, Torrance, CA, United States; Division of Genomic Outcomes, Departments of Pediatrics and Medicine, Harbor-UCLA Medical Center, Torrance, CA, United States; Alzheimer's Disease Cooperative Study, University of California San Diego, San Diego, CA, United States; Department of Neuroscience, School of Medicine at UCSD, University of California San Diego, San Diego, CA, United States; Alzheimer's Therapeutic Research Institute, University of Southern California, San Diego, CA, United States; Indiana University School of Medicine, Indiana Alzheimer's Disease Center, Indianapolis, IN, United States","Sokolow S., School of Nursing, University of California at Los Angeles, 700 Tiverton Avenue, Factor Bldg 5-238, Los Angeles, 90095-6919, CA, United States, Brain Research Institute, University of California at Los Angeles, Los Angeles, CA, United States; Li X., Institute for Translational Genomics and Population Sciences, Department of Pediatrics, Los Angeles Biomedical Research Institute, Harbor-UCLA Medical Center, Torrance, CA, United States, Division of Genomic Outcomes, Departments of Pediatrics and Medicine, Harbor-UCLA Medical Center, Torrance, CA, United States; Chen L., School of Nursing, University of California at Los Angeles, 700 Tiverton Avenue, Factor Bldg 5-238, Los Angeles, 90095-6919, CA, United States; Taylor K.D., Institute for Translational Genomics and Population Sciences, Department of Pediatrics, Los Angeles Biomedical Research Institute, Harbor-UCLA Medical Center, Torrance, CA, United States, Division of Genomic Outcomes, Departments of Pediatrics and Medicine, Harbor-UCLA Medical Center, Torrance, CA, United States; Rotter J.I., Institute for Translational Genomics and Population Sciences, Department of Pediatrics, Los Angeles Biomedical Research Institute, Harbor-UCLA Medical Center, Torrance, CA, United States, Division of Genomic Outcomes, Departments of Pediatrics and Medicine, Harbor-UCLA Medical Center, Torrance, CA, United States; Rissman R.A., Alzheimer's Disease Cooperative Study, University of California San Diego, San Diego, CA, United States, Department of Neuroscience, School of Medicine at UCSD, University of California San Diego, San Diego, CA, United States; Aisen P.S., Alzheimer's Therapeutic Research Institute, University of Southern California, San Diego, CA, United States; Apostolova L.G., Indiana University School of Medicine, Indiana Alzheimer's Disease Center, Indianapolis, IN, United States","S. Sokolow; School of Nursing, University of California at Los Angeles, Los Angeles, 700 Tiverton Avenue, Factor Bldg 5-238, 90095-6919, United States; email: ssokolow@sonnet.ucla.edu","","IOS Press","13872877","","JADIF","27911294","English","J. Alzheimer's Dis.","Article","Final","All Open Access; Green Open Access","Scopus","2-s2.0-85040073900"
"Racchi M.; Mazzucchelli M.; Lenzken S.C.; Porrello E.; Lanni C.; Govoni S.","Racchi, Marco (57195753635); Mazzucchelli, Michela (8067948200); Lenzken, S. Carolina (9746204600); Porrello, Emanuela (56840517600); Lanni, Cristina (7003271971); Govoni, Stefano (8159178800)","57195753635; 8067948200; 9746204600; 56840517600; 7003271971; 8159178800","Role of acetylcholinesterase inhibitors in the regulation of amyloid β precursor protein (AβPP) metabolism","2005","Chemico-Biological Interactions","157-158","","","335","338","3","19","10.1016/j.cbi.2005.10.099","https://www.scopus.com/inward/record.uri?eid=2-s2.0-28744434455&doi=10.1016%2fj.cbi.2005.10.099&partnerID=40&md5=265377136a06c8a0db9c3701cf16aa0d","Centre of Excellence in Applied Biology (CEBA), Department of Experimental and Applied Pharmacology, University of Pavia, Pavia 27100, Viale Taramelli 14, Italy","Racchi M., Centre of Excellence in Applied Biology (CEBA), Department of Experimental and Applied Pharmacology, University of Pavia, Pavia 27100, Viale Taramelli 14, Italy; Mazzucchelli M., Centre of Excellence in Applied Biology (CEBA), Department of Experimental and Applied Pharmacology, University of Pavia, Pavia 27100, Viale Taramelli 14, Italy; Lenzken S.C., Centre of Excellence in Applied Biology (CEBA), Department of Experimental and Applied Pharmacology, University of Pavia, Pavia 27100, Viale Taramelli 14, Italy; Porrello E., Centre of Excellence in Applied Biology (CEBA), Department of Experimental and Applied Pharmacology, University of Pavia, Pavia 27100, Viale Taramelli 14, Italy; Lanni C., Centre of Excellence in Applied Biology (CEBA), Department of Experimental and Applied Pharmacology, University of Pavia, Pavia 27100, Viale Taramelli 14, Italy; Govoni S., Centre of Excellence in Applied Biology (CEBA), Department of Experimental and Applied Pharmacology, University of Pavia, Pavia 27100, Viale Taramelli 14, Italy","M. Racchi; Centre of Excellence in Applied Biology (CEBA), Department of Experimental and Applied Pharmacology, University of Pavia, Pavia 27100, Viale Taramelli 14, Italy; email: racchi@unipv.it","","","00092797","","CBINA","16297899","English","Chem.-Biol. Interact.","Conference paper","Final","","Scopus","2-s2.0-28744434455"
